Country,Officialstatename,InternetccTLD,iso2,iso3,fragility_date,fragility,co2,co2_date,region,ForestRev_gdp,ForestRev_date
Afghanistan,The Islamic Republic of Afghanistan,.af,AF,AFG,2019,105.0,7893000.0,2019,SOUTH ASIA,0.2,2018
Albania,The Republic of Albania,.al,AL,ALB,2019,58.9,3794000.0,2019,EUROPE,0.18,2018
Algeria,The People's Democratic Republic of Algeria,.dz,DZ,DZA,2019,75.4,151633000.0,2019,AFRICA,0.1,2018
Angola,The Republic of Angola,.ao,AO,AGO,2019,87.8,19362000.0,2019,AFRICA,0.36,2018
Antigua and Barbuda,Antigua and Barbuda,.ag,AG,ATG,2019,54.4,729000.0,2019,CENTRAL AMERICA AND THE CARIBBEAN,0.0,2018
Argentina,The Argentine Republic,.ar,AR,ARG,2019,46.0,193205000.0,2019,SOUTH AMERICA,0.09,2018
Armenia,The Republic of Armenia,.am,AM,ARM,2019,66.7,6354000.0,2019,MIDDLE EAST,0.28,2018
Australia,The Commonwealth of Australia,.au,AU,AUS,2019,19.7,417870000.0,2019,AUSTRALIA AND OCEANIA,0.13,2018
Austria,The Republic of Austria,.at,AT,AUT,2019,25.0,65540000.0,2019,EUROPE,0.07,2018
Azerbaijan,The Republic of Azerbaijan,.az,AZ,AZE,2019,73.2,35389000.0,2019,MIDDLE EAST,0.02,2018
Bahamas (the),The Commonwealth of The Bahamas,.bs,BS,BHS,2019,48.8,3984000.0,2019,CENTRAL AMERICA AND THE CARIBBEAN,0.01,2018
Bahrain,The Kingdom of Bahrain,.bh,BH,BHR,2019,63.8,43112000.0,2019,MIDDLE EAST,0.0,2018
Bangladesh,The People's Republic of Bangladesh,.bd,BD,BGD,2019,87.7,96180000.0,2019,SOUTH ASIA,0.08,2018
Barbados,Barbados,.bb,BB,BRB,2019,48.0,1703000.0,2019,CENTRAL AMERICA AND THE CARIBBEAN,0.01,2018
Belarus,The Republic of Belarus,.by,BY,BLR,2019,68.2,54695000.0,2019,EUROPE,1.02,2018
Belgium,The Kingdom of Belgium,.be,BE,BEL,2019,28.6,128247000.0,2019,EUROPE,0.02,2018
Belize,Belize,.bz,BZ,BLZ,2019,62.5,541000.0,2019,CENTRAL AMERICA AND THE CARIBBEAN,0.31,2018
Benin,The Republic of Benin,.bj,BJ,BEN,2019,73.6,6903000.0,2019,AFRICA,2.24,2018
Bhutan,The Kingdom of Bhutan,.bt,BT,BTN,2019,72.0,934000.0,2019,SOUTH ASIA,1.89,2018
Bolivia (Plurinational State of),The Plurinational State of Bolivia,.bo,BO,BOL,2019,72.9,17786000.0,2019,SOUTH AMERICA,0.33,2018
Bosnia and Herzegovina,Bosnia and Herzegovina,.ba,BA,BIH,2019,71.3,16209000.0,2019,EUROPE,0.49,2018
Botswana,The Republic of Botswana,.bw,BW,BWA,2019,59.5,5965000.0,2019,AFRICA,0.23,2018
Brazil,The Federative Republic of Brazil,.br,BR,BRA,2019,71.8,456670000.0,2019,SOUTH AMERICA,0.62,2018
British Indian Ocean Territory (the),The British Indian Ocean Territory,.io,IO,IOT,2019,92.5,4523000.0,2019,AFRICA,3.17,2018
Brunei Darussalam,"The Nation of Brunei, the Abode of Peace",.bn,BN,BRN,2019,57.5,9956000.0,2019,EAST AND SOUTHEAST ASIA,0.05,2018
Bulgaria,The Republic of Bulgaria,.bg,BG,BGR,2019,50.6,38373000.0,2019,EUROPE,0.22,2018
Burkina Faso,Burkina Faso,.bf,BF,BFA,2019,83.9,4444000.0,2019,AFRICA,4.54,2018
Burundi,The Republic of Burundi,.bi,BI,BDI,2019,98.2,715000.0,2019,AFRICA,10.31,2018
Cambodia,The Kingdom of Cambodia,.kh,KH,KHM,2019,82.5,13844000.0,2019,EAST AND SOUTHEAST ASIA,0.84,2018
Cameroon,The Republic of Cameroon,.cm,CM,CMR,2019,97.0,7105000.0,2019,AFRICA,2.5,2018
Canada,Canada,.ca,CA,CAN,2019,20.0,612084000.0,2019,NORTH AMERICA,0.08,2018
Central African Republic (the),The Central African Republic,.cf,CF,CAF,2019,108.9,285000.0,2019,AFRICA,8.99,2018
Chad,The Republic of Chad,.td,TD,TCD,2019,108.5,1771000.0,2019,AFRICA,3.81,2018
Chile,The Republic of Chile,.cl,CL,CHL,2019,38.9,88333000.0,2019,SOUTH AMERICA,0.49,2018
China,The People's Republic of China,.cn,CN,CHN,2019,71.1,10773248000.0,2019,EAST AND SOUTHEAST ASIA,0.08,2018
Colombia,The Republic of Colombia,.co,CO,COL,2019,75.7,81007000.0,2019,SOUTH AMERICA,0.1,2018
Comoros (the),The Union of the Comoros,.km,KM,COM,2019,81.7,326000.0,2019,AFRICA,1.39,2018
Congo (the Democratic Republic of the),The Democratic Republic of the Congo,.cd,CD,COD,2019,110.2,2653000.0,2019,AFRICA,8.72,2018
Congo (the Democratic Republic of the),The Democratic Republic of the Congo,.cd,CD,COD,2019,76.2,2653000.0,2019,AFRICA,8.72,2018
Congo (the Democratic Republic of the),The Democratic Republic of the Congo,.cd,CD,COD,2019,40.5,2653000.0,2019,AFRICA,8.72,2018
Costa Rica,The Republic of Costa Rica,.cr,CR,CRI,2019,42.0,8115000.0,2019,CENTRAL AMERICA AND THE CARIBBEAN,0.82,2018
Côte d'Ivoire,The Republic of Côte d'Ivoire,.ci,CI,CIV,2019,92.1,11880000.0,2019,AFRICA,2.04,2016
Croatia,The Republic of Croatia,.hr,HR,HRV,2019,47.5,16752000.0,2019,EUROPE,0.26,2018
Cuba,The Republic of Cuba,.cu,CU,CUB,2019,60.8,16478000.0,2019,CENTRAL AMERICA AND THE CARIBBEAN,0.06,2018
Cyprus,The Republic of Cyprus,.cy,CY,CYP,2019,57.8,8024000.0,2019,EUROPE,0.0,2018
Czechia,The Czech Republic,.cz,CZ,CZE,2019,37.6,99533000.0,2019,EUROPE,0.17,2017
Denmark,The Kingdom of Denmark,.dk,DK,DNK,2019,19.5,33850000.0,2019,EUROPE,0.02,2018
Djibouti,The Republic of Djibouti,.dj,DJ,DJI,2019,85.1,610000.0,2019,AFRICA,0.26,2018
Dominican Republic (the),The Dominican Republic,.do,DO,DOM,2019,66.2,26808000.0,2019,CENTRAL AMERICA AND THE CARIBBEAN,0.03,2018
Ecuador,The Republic of Ecuador,.ec,EC,ECU,2019,71.2,36051000.0,2019,SOUTH AMERICA,0.27,2018
Egypt,The Arab Republic of Egypt,.eg,EG,EGY,2019,88.4,235137000.0,2019,AFRICA,0.15,2018
El Salvador,The Republic of El Salvador,.sv,SV,SLV,2019,69.8,7632000.0,2019,CENTRAL AMERICA AND THE CARIBBEAN,0.6,2018
Equatorial Guinea,The Republic of Equatorial Guinea,.gq,GQ,GNQ,2019,82.6,4528000.0,2019,AFRICA,1.52,2018
Estonia,The Republic of Estonia,.ee,EE,EST,2019,40.8,4924000.0,2019,EUROPE,0.85,2018
Eswatini,The Kingdom of Eswatini,.sz,SZ,SWZ,2019,85.3,1224000.0,2019,AFRICA,2.25,2018
Ethiopia,The Federal Democratic Republic of Ethiopia,.et,ET,ETH,2019,94.2,16798000.0,2019,AFRICA,5.81,2018
Fiji,The Republic of Fiji,.fj,FJ,FJI,2019,71.7,1691000.0,2019,AUSTRALIA AND OCEANIA,0.59,2018
Finland,The Republic of Finland,.fi,FI,FIN,2019,16.9,41996000.0,2019,EUROPE,0.36,2018
France,The French Republic,.fr,FR,FRA,2019,32.0,338425000.0,2019,EUROPE,0.03,2018
Gabon,The Gabonese Republic,.ga,GA,GAB,2019,70.5,2651000.0,2019,AFRICA,2.6,2018
Gambia (the),The Republic of The Gambia,.gm,GM,GMB,2019,83.9,606000.0,2019,AFRICA,2.47,2018
Georgia,Georgia,.ge,GE,GEO,2019,72.0,10299000.0,2019,MIDDLE EAST,0.07,2018
Germany,The Federal Republic of Germany,.de,DE,DEU,2019,24.7,726881000.0,2019,EUROPE,0.03,2018
Ghana,The Republic of Ghana,.gh,GH,GHA,2019,65.9,18093000.0,2019,AFRICA,3.51,2018
Greece,The Hellenic Republic,.gr,GR,GRC,2019,53.9,70163000.0,2019,EUROPE,0.01,2018
Grenada,Grenada,.gd,GD,GRD,2019,57.6,316000.0,2019,CENTRAL AMERICA AND THE CARIBBEAN,0.0,2018
Guatemala,The Republic of Guatemala,.gt,GT,GTM,2019,81.4,19041000.0,2019,CENTRAL AMERICA AND THE CARIBBEAN,0.78,2018
Guinea,The Republic of Guinea,.gn,GN,GIN,2019,99.4,2981000.0,2019,AFRICA,4.81,2018
Guinea-Bissau,The Republic of Guinea-Bissau,.gw,GW,GNB,2019,95.5,342000.0,2019,AFRICA,9.24,2018
Guyana,The Co-operative Republic of Guyana,.gy,GY,GUY,2019,68.2,2743000.0,2019,SOUTH AMERICA,4.56,2018
Haiti,The Republic of Haiti,.ht,HT,HTI,2019,99.3,3139000.0,2019,CENTRAL AMERICA AND THE CARIBBEAN,0.68,2018
Honduras,The Republic of Honduras,.hn,HN,HND,2019,77.8,8523000.0,2019,CENTRAL AMERICA AND THE CARIBBEAN,0.91,2018
Hungary,Hungary,.hu,HU,HUN,2019,49.6,48589000.0,2019,EUROPE,0.1,2018
Iceland,Iceland,.is,IS,ISL,2019,19.8,3337000.0,2019,EUROPE,0.0,2018
India,The Republic of India,.in,IN,IND,2019,74.4,2314738000.0,2019,SOUTH ASIA,0.14,2018
Indonesia,The Republic of Indonesia,.id,ID,IDN,2019,70.4,563543000.0,2019,EAST AND SOUTHEAST ASIA,0.39,2018
Iran (Islamic Republic of),The Islamic Republic of Iran,.ir,IR,IRN,2019,83.0,646038000.0,2019,MIDDLE EAST,0.01,2017
Iraq,The Republic of Iraq,.iq,IQ,IRQ,2019,99.1,143479000.0,2019,MIDDLE EAST,0.0,2018
Ireland,Ireland,.ie,IE,IRL,2019,20.6,35475000.0,2019,EUROPE,0.01,2018
Italy,The Italian Republic,.it,IT,ITA,2019,43.8,332041000.0,2019,EUROPE,0.01,2018
Jamaica,Jamaica,.jm,JM,JAM,2019,61.2,10002000.0,2019,CENTRAL AMERICA AND THE CARIBBEAN,0.15,2018
Japan,Japan,.jp,JP,JPN,2019,34.3,1103234000.0,2019,EAST AND SOUTHEAST ASIA,0.02,2018
Jordan,The Hashemite Kingdom of Jordan,.jo,JO,JOR,2019,75.9,23470000.0,2019,MIDDLE EAST,0.02,2018
Kazakhstan,The Republic of Kazakhstan,.kz,KZ,KAZ,2019,61.6,263689000.0,2019,CENTRAL ASIA,0.0,2018
Kenya,The Republic of Kenya,.ke,KE,KEN,2019,93.5,17709000.0,2019,AFRICA,1.3,2018
Korea (the Republic of),The Republic of Korea,.kr,KR,KOR,2019,33.7,686954000.0,2019,EAST AND SOUTHEAST ASIA,0.01,2018
Kuwait,The State of Kuwait,.kw,KW,KWT,2019,53.2,92582000.0,2019,MIDDLE EAST,0.0,2018
Latvia,The Republic of Latvia,.lv,LV,LVA,2019,43.9,8450000.0,2019,EUROPE,0.85,2018
Lebanon,The Lebanese Republic,.lb,LB,LBN,2019,85.0,25838000.0,2019,MIDDLE EAST,0.0,2018
Lesotho,The Kingdom of Lesotho,.ls,LS,LSO,2019,79.7,736000.0,2019,AFRICA,3.34,2018
Liberia,The Republic of Liberia,.lr,LR,LBR,2019,90.2,1346000.0,2019,AFRICA,13.27,2018
Libya,The State of Libya,.ly,LY,LBY,2019,92.2,38297000.0,2019,AFRICA,0.06,2018
Lithuania,The Republic of Lithuania,.lt,LT,LTU,2019,38.1,14503000.0,2019,EUROPE,0.31,2018
Luxembourg,The Grand Duchy of Luxembourg,.lu,LU,LUX,2019,20.4,11308000.0,2019,EUROPE,0.01,2018
North Macedonia,The Republic of North Macedonia[12],.mk,MK,MKD,2019,64.6,7383000.0,2019,EUROPE,0.15,2018
Madagascar,The Republic of Madagascar,.mg,MG,MDG,2019,80.9,4218000.0,2019,AFRICA,4.34,2018
Malawi,The Republic of Malawi,.mw,MW,MWI,2019,83.3,1542000.0,2019,AFRICA,6.19,2018
Malaysia,Malaysia,.my,MY,MYS,2019,60.5,254764000.0,2019,EAST AND SOUTHEAST ASIA,1.57,2018
Maldives,The Republic of Maldives,.mv,MV,MDV,2019,69.8,2286000.0,2019,SOUTH ASIA,0.0,2018
Mali,The Republic of Mali,.ml,ML,MLI,2019,94.5,5679000.0,2019,AFRICA,2.02,2018
Malta,The Republic of Malta,.mt,MT,MLT,2019,34.5,9576000.0,2019,EUROPE,0.0,2018
Mauritania,The Islamic Republic of Mauritania,.mr,MR,MRT,2019,90.1,4041000.0,2019,AFRICA,1.3,2018
Mauritius,The Republic of Mauritius,.mu,MU,MUS,2019,38.9,7191000.0,2019,AFRICA,0.0,2018
Mexico,The United Mexican States,.mx,MX,MEX,2019,69.7,463739000.0,2019,NORTH AMERICA,0.1,2018
Micronesia (Federated States of),The Federated States of Micronesia,.fm,FM,FSM,2019,73.0,177000.0,2019,AUSTRALIA AND OCEANIA,0.02,2018
Moldova (the Republic of),The Republic of Moldova,.md,MD,MDA,2019,67.1,8114000.0,2019,EUROPE,0.26,2018
Mongolia,Mongolia,.mn,MN,MNG,2019,54.1,22740000.0,2019,EAST AND SOUTHEAST ASIA,0.14,2018
Montenegro,Montenegro,.me,ME,MNE,2019,55.3,2447000.0,2019,EUROPE,0.43,2018
Morocco,The Kingdom of Morocco,.ma,MA,MAR,2019,73.0,60200000.0,2019,AFRICA,0.13,2018
Mozambique,The Republic of Mozambique,.mz,MZ,MOZ,2019,88.7,7753000.0,2019,AFRICA,6.46,2018
Namibia,The Republic of Namibia,.na,,NAM,2019,66.4,3831000.0,2019,AFRICA,0.47,2018
Nepal,The Federal Democratic Republic of Nepal,.np,NP,NPL,2019,84.7,7708000.0,2019,SOUTH ASIA,0.45,2018
Netherlands (the),The Kingdom of the Netherlands,.nl,NL,NLD,2019,24.8,214416000.0,2019,EUROPE,0.01,2018
New Zealand,New Zealand,.nz,NZ,NZL,2019,20.1,40344000.0,2019,AUSTRALIA AND OCEANIA,0.5,2018
Nicaragua,The Republic of Nicaragua,.ni,NI,NIC,2019,78.1,4851000.0,2019,CENTRAL AMERICA AND THE CARIBBEAN,1.26,2018
Niger (the),The Republic of the Niger,.ne,NE,NER,2019,96.2,2374000.0,2019,AFRICA,4.41,2018
Nigeria,The Federal Republic of Nigeria,.ng,NG,NGA,2019,98.5,104494000.0,2019,AFRICA,1.02,2018
Norway,The Kingdom of Norway,.no,NO,NOR,2019,18.0,36731000.0,2019,EUROPE,0.05,2018
Oman,The Sultanate of Oman,.om,OM,OMN,2019,50.0,76321000.0,2019,MIDDLE EAST,0.0,2018
Pakistan,The Islamic Republic of Pakistan,.pk,PK,PAK,2019,94.2,193869000.0,2019,SOUTH ASIA,0.1,2018
Panama,The Republic of Panamá,.pa,PA,PAN,2019,47.0,25263000.0,2019,CENTRAL AMERICA AND THE CARIBBEAN,0.08,2018
Papua New Guinea,The Independent State of Papua New Guinea,.pg,PG,PNG,2019,83.1,6491000.0,2019,EAST AND SOUTHEAST ASIA,2.08,2018
Paraguay,The Republic of Paraguay,.py,PY,PRY,2019,67.0,7896000.0,2019,SOUTH AMERICA,1.21,2018
Peru,The Republic of Perú,.pe,PE,PER,2019,68.2,54996000.0,2019,SOUTH AMERICA,0.12,2018
Philippines (the),The Republic of the Philippines,.ph,PH,PHL,2019,83.1,142282000.0,2019,EAST AND SOUTHEAST ASIA,0.18,2018
Poland,The Republic of Poland,.pl,PL,POL,2019,42.8,304040000.0,2019,EUROPE,0.17,2018
Portugal,The Portuguese Republic,.pt,PT,PRT,2019,25.3,50370000.0,2019,EUROPE,0.13,2018
Qatar,The State of Qatar,.qa,QA,QAT,2019,45.4,111922000.0,2019,MIDDLE EAST,0.0,2018
Romania,Romania,.ro,RO,ROU,2019,47.8,68746000.0,2019,EUROPE,0.16,2018
Russian Federation (the),The Russian Federation,.ru,RU,RUS,2019,74.7,1848070000.0,2019,CENTRAL ASIA,0.29,2018
Rwanda,The Republic of Rwanda,.rw,RW,RWA,2019,87.5,1189000.0,2019,AFRICA,3.75,2018
Samoa,The Independent State of Samoa,.ws,WS,WSM,2019,64.2,355000.0,2019,AUSTRALIA AND OCEANIA,0.27,2018
Sao Tome and Principe,The Democratic Republic of São Tomé and Príncipe,.st,ST,STP,2019,71.1,173000.0,2019,AFRICA,1.9,2018
Saudi Arabia,The Kingdom of Saudi Arabia,.sa,SA,SAU,2019,70.4,579925000.0,2019,MIDDLE EAST,0.0,2018
Senegal,The Republic of Senegal,.sn,SN,SEN,2019,77.2,10696000.0,2019,AFRICA,1.46,2018
Serbia,The Republic of Serbia,.rs,RS,SRB,2019,68.0,47735000.0,2019,EUROPE,0.38,2018
Seychelles,The Republic of Seychelles,.sc,SC,SYC,2019,55.2,1156000.0,2019,AFRICA,0.09,2018
Sierra Leone,The Republic of Sierra Leone,.sl,SL,SLE,2019,86.8,899000.0,2019,AFRICA,6.92,2018
Singapore,The Republic of Singapore,.sg,SG,SGP,2019,28.1,238983000.0,2019,EAST AND SOUTHEAST ASIA,0.0,2018
Slovenia,The Republic of Slovenia,.si,SI,SVN,2019,28.0,13553000.0,2019,EUROPE,0.2,2018
Solomon Islands,The Solomon Islands,.sb,SB,SLB,2019,81.9,333000.0,2019,AUSTRALIA AND OCEANIA,20.27,2018
South Sudan,The Republic of South Sudan,.ss,SS,SSD,2019,112.2,1778000.0,2019,AFRICA,2.65,2015
South Sudan,The Republic of South Sudan,.ss,SS,SSD,2019,108.0,17319000.0,2019,AFRICA,3.01,2018
Spain,The Kingdom of Spain,.es,ES,ESP,2019,40.7,280624000.0,2019,EUROPE,0.02,2018
Sri Lanka,The Democratic Socialist Republic of Sri Lanka,.lk,LK,LKA,2019,84.0,23939000.0,2019,SOUTH ASIA,0.06,2018
Suriname,The Republic of Suriname,.sr,SR,SUR,2019,61.9,2372000.0,2019,SOUTH AMERICA,2.36,2018
Sweden,The Kingdom of Sweden,.se,SE,SWE,2019,20.3,48144000.0,2019,EUROPE,0.21,2018
Switzerland,The Swiss Confederation,.ch,CH,CHE,2019,18.7,38739000.0,2019,EUROPE,0.01,2018
Tajikistan,The Republic of Tajikistan,.tj,TJ,TJK,2019,77.7,7643000.0,2019,CENTRAL ASIA,1.12,2018
"Tanzania, the United Republic of",The United Republic of Tanzania,.tz,TZ,TZA,2019,80.1,11491000.0,2019,AFRICA,2.19,2018
Thailand,The Kingdom of Thailand,.th,TH,THA,2019,73.1,305273000.0,2019,EAST AND SOUTHEAST ASIA,0.34,2018
Timor-Leste,The Democratic Republic of Timor-Leste,.tl,TL,TLS,2019,85.5,538000.0,2019,EAST AND SOUTHEAST ASIA,0.13,2018
Togo,The Togolese Republic,.tg,TG,TGO,2019,87.4,2244000.0,2019,AFRICA,3.96,2018
Trinidad and Tobago,The Republic of Trinidad and Tobago,.tt,TT,TTO,2019,53.0,39652000.0,2019,CENTRAL AMERICA AND THE CARIBBEAN,0.05,2018
Tunisia,The Republic of Tunisia,.tn,TN,TUN,2019,70.1,23692000.0,2019,AFRICA,0.21,2018
Turkey,The Republic of Turkey,.tr,TR,TUR,2019,80.3,391792000.0,2019,MIDDLE EAST,0.08,2018
Turkmenistan,Turkmenistan,.tm,TM,TKM,2019,71.4,109037000.0,2019,CENTRAL ASIA,0.0,2018
Uganda,The Republic of Uganda,.ug,UG,UGA,2019,95.3,5841000.0,2019,AFRICA,7.32,2018
Ukraine,Ukraine,.ua,UA,UKR,2019,71.0,185686000.0,2019,EUROPE,0.34,2018
United Arab Emirates (the),The United Arab Emirates,.ae,AE,ARE,2019,40.1,276236000.0,2019,MIDDLE EAST,0.0,2018
United Kingdom of Great Britain and Northern Ireland (the),The United Kingdom of Great Britain and Northern Ireland,.uk,GB,GBR,2019,36.7,398084000.0,2019,EUROPE,0.01,2018
United States of America (the),The United States of America,.us,US,USA,2019,38.0,5144361000.0,2019,NORTH AMERICA,0.04,2018
Uruguay,The Oriental Republic of Uruguay,.uy,UY,URY,2019,34.0,6450000.0,2019,SOUTH AMERICA,1.56,2018
Uzbekistan,The Republic of Uzbekistan,.uz,UZ,UZB,2019,75.7,102965000.0,2019,CENTRAL ASIA,0.0,2018
Viet Nam,The Socialist Republic of Viet Nam,.vn,VN,VNM,2019,66.1,249929000.0,2019,EAST AND SOUTHEAST ASIA,1.49,2018
Yemen,The Republic of Yemen,.ye,YE,YEM,2019,113.5,10158000.0,2019,MIDDLE EAST,0.04,2018
Zambia,The Republic of Zambia,.zm,ZM,ZMB,2019,85.7,6798000.0,2019,AFRICA,4.45,2018
Zimbabwe,The Republic of Zimbabwe,.zw,ZW,ZWE,2019,99.5,7902000.0,2019,AFRICA,1.61,2018
